{
  "$schema": "https://json-schema.org/draft/2020-12/schema",
  "$id": "https://frontier-wire.example/schemas/run_plan.schema.json",
  "title": "Run Plan",
  "description": "Spec-silent shape (the approved build plan's Phase 2 section names 'scripts/plan_run.py ... writes data/run_plan.json (today's cluster subset, pre-computed card IDs ..., degradation-ladder decision)' without fixing fields; decision logged in IMPROVEMENT_BACKLOG.md). Written by the pure-code plan_run.py step before the analyst runs, so the LLM never invents or collides card IDs and the degradation ladder (CLAUDE.md's quota-degradation section) is decided deterministically, not by the analyst's own discretion. run_mode 'skip' is the unconditional empty-queue case (cards_cap/clusters/reason should reflect nothing-to-publish); 'normal'/'capped'/'digest' correspond to degradation_level 0, 1-2, and 3 respectively per CLAUDE.md's ladder. Phase 8 adds profile_target/profile_reason: the deterministic, pure-code PROFILER-target selection (scripts/plan_run.py::decide_profile_target) -- at most one company per run, picked before the PROFILER (or ANALYST, if the two roles are ever merged) ever runs, same 'the LLM never invents its own target' rationale as proposed_card_id.",
  "type": "object",
  "required": [
    "version",
    "generated_at",
    "degradation_level",
    "run_mode",
    "cards_cap",
    "clusters",
    "reason",
    "profile_target",
    "profile_reason"
  ],
  "properties": {
    "version": {
      "type": "integer",
      "const": 1
    },
    "generated_at": {
      "type": "string",
      "format": "date-time"
    },
    "degradation_level": {
      "type": "integer",
      "minimum": 0,
      "maximum": 3,
      "description": "vars.QUOTA_DEGRADATION_LEVEL at plan time: 0 normal, 1 capped (top-5), 2 every-other-day, 3 weekly digest -- per CLAUDE.md's quota-degradation ladder."
    },
    "run_mode": {
      "type": "string",
      "enum": ["normal", "capped", "skip", "digest"],
      "description": "'skip' is forced whenever data/queue.json is empty, unconditionally, regardless of degradation_level -- CLAUDE.md's 'empty queue = exit without inventing news' rule."
    },
    "cards_cap": {
      "type": ["integer", "null"],
      "minimum": 0,
      "description": "Max cards the analyst may write this run (e.g. 8 normal, 5 capped, 1 digest); null when run_mode is 'skip'."
    },
    "clusters": {
      "type": "array",
      "description": "The cluster subset selected for this run, in rank order; empty when run_mode is 'skip'.",
      "items": {
        "type": "object",
        "required": ["cluster_hash", "proposed_card_id", "rank"],
        "properties": {
          "cluster_hash": {
            "type": "string",
            "minLength": 1,
            "description": "Joins back to data/ledger.json's entries key and data/queue.json's own cluster_hash."
          },
          "proposed_card_id": {
            "type": "string",
            "minLength": 1,
            "pattern": "^[0-9]{4}-[0-9]{2}-[0-9]{2}-[a-z0-9-]+$",
            "description": "Pre-computed content/cards/<id>.json slug so the analyst never invents or collides IDs. Pattern-locked to scripts/plan_run.py::compute_proposed_card_id's own '<YYYY-MM-DD>-<kebab-slug>-<hash6>' output: this value is concatenated into a filesystem path by scripts/reconcile_run.py, so a free-form string here (e.g. one containing '../') would be a path-traversal vector from analyst-writable data/run_plan.json."
          },
          "rank": {
            "type": "integer",
            "minimum": 1
          }
        },
        "additionalProperties": false
      }
    },
    "reason": {
      "type": "string",
      "description": "Short human-readable explanation of the run_mode/degradation_level decision (e.g. 'queue empty', 'degradation_level=1: capped to top 5', 'normal run, 8 clusters available')."
    },
    "profile_target": {
      "type": ["string", "null"],
      "pattern": "^[a-z0-9-]+$",
      "description": "Phase 8: at most one content/companies/<id>.json company id the PROFILER should refresh this run, or null if no candidate was found (or run_mode is 'skip'). Picked deterministically by scripts/plan_run.py::decide_profile_target, in priority order: (1) a company named by name/alias in one of this run's selected cluster's own source titles -- a deterministic *prediction* that this run's ANALYST is likely to upsert that company's frontier_board.json row, since plan_run.py itself runs before the analyst and has no visibility into what the analyst will actually write; (2) absent that, the company with the oldest last_verified across content/companies/*.json, only if that date is more than 45 days before this run's date; (3) otherwise null. Always null when run_mode is 'skip' -- CLAUDE.md's 'nothing to do this run' rule applies to the profile target exactly as it does to clusters."
    },
    "profile_reason": {
      "type": "string",
      "description": "Short human-readable explanation of the profile_target decision (always present, even when profile_target is null) -- e.g. 'company id anthropic is named ... in one of this run's selected clusters', 'no selected cluster names a tracked company ... company id mistral has the oldest last_verified and is more than 45 days stale', 'run_mode is skip -- nothing to do this run'."
    }
  },
  "additionalProperties": false
}
